{
  "schema_version": 1,
  "key": "fincept-terminal",
  "input_url": "https://github.com/Fincept-Corporation/FinceptTerminal",
  "canonical_url": "https://github.com/Fincept-Corporation/FinceptTerminal",
  "source_directory": "fincept-terminal/upstream",
  "commit": "6d82e1f8d6e81c506efeec312414b5d472b437cb",
  "nested_submodules": []
}
